{
  "change_id": "CR-2026-03-29-x-bookmarks-hold-remediation",
  "change_type": "bugfix",
  "summary": "Clear the strict-safety release hold by centralizing X-Bookmarks runtime env/loading, HTTP error handling, logging/output routing, and atomic token persistence, while fixing the linked CLI and OAuth failure-path defects in the three affected scripts.",
  "symptom_location": "python3 scripts/check_governance_core/check_governance_core_main.py --fail-on-safety-warnings failed because X-Bookmarks Import scripts triggered 73 Python safety errors and 2 warnings.",
  "authority_fix_point": "X-Bookmarks Import/x_runtime.py, X-Bookmarks Import/x_bookmarks_auth.py, and X-Bookmarks Import/x_bookmarks_bookmarks.py, extended by the three X-Bookmarks entry scripts that now consume the shared runtime contract.",
  "root_cause_statement": "Three standalone X-Bookmarks scripts each reimplemented env loading, HTTP JSON/error parsing, CLI/logging output, and token/state writes. Those duplicate implementations used print-based diagnostics, broad silent exception fallbacks, and direct token writes, so strict safety failures and misleading failure-path behavior were structurally inevitable.",
  "class_of_errors_prevented": "Cross-script runtime safety regressions in the X-Bookmarks tools: print-based diagnostics, silent HTTP parse fallbacks, non-atomic token writes, offline-safe CLI paths blocked by token gates, misleading rate-limit/auth outcomes, and missing OAuth callback state validation.",
  "mre": {
    "fixture_path": "X-Bookmarks Import/",
    "pre_fix_failure_signal": "python3 scripts/check_python_safety/check_python_safety_main.py reported 73 error(s) and 2 warning(s) across fetch_bookmarks.py, governance_research.py, and x_search.py.",
    "post_fix_pass_signal": "python3 scripts/check_python_safety/check_python_safety_main.py reports Summary: 0 error(s), 0 warning(s), and python3 scripts/check_governance_core/check_governance_core_main.py --fail-on-safety-warnings passes."
  },
  "tests": {
    "regression": "python3 scripts/check_python_safety/check_python_safety_main.py",
    "disconfirming": "X_BEARER_TOKEN='' python3 'X-Bookmarks Import/skills/governance-autoresearch/scripts/governance_research.py' --list ; X_BEARER_TOKEN='' python3 'X-Bookmarks Import/skills/x-research/scripts/x_search.py' --help",
    "failure_path": "X_CLIENT_ID='' X_CLIENT_SECRET='' python3 'X-Bookmarks Import/fetch_bookmarks.py' ; X_BEARER_TOKEN='dummy' python3 'X-Bookmarks Import/skills/x-research/scripts/x_search.py' --days=abc 'topic'"
  },
  "verification_commands": [
    "python3 scripts/check_python_safety/check_python_safety_main.py",
    "python3 scripts/check_governance_core/check_governance_core_main.py --fail-on-safety-warnings",
    "python3 scripts/check_governance_core/check_governance_core_main.py",
    "pwsh -NoProfile -ExecutionPolicy Bypass -File scripts/check_change_records.ps1"
  ],
  "invariants": [
    "INV-OBS-1: Strict safety mode must report zero Python safety errors and warnings across the repo.",
    "INV-D-1: X-Bookmarks runtime concerns (env loading, HTTP error parsing, logging/output routing, and atomic token persistence) must have one shared authority.",
    "INV-LIF-1: OAuth callback validation and token persistence must fail explicitly and write state atomically.",
    "INV-CLI-1: Offline-safe CLI modes (`--help`, `--list`) must work without tokens, while networked modes fail explicitly with non-zero exit status."
  ],
  "witnesses": [
    {
      "invariant_id": "INV-OBS-1",
      "signal": "Python safety and strict governance core outputs are fully green",
      "record_location": "python3 scripts/check_python_safety/check_python_safety_main.py stdout and python3 scripts/check_governance_core/check_governance_core_main.py --fail-on-safety-warnings stdout",
      "pass_criteria": "both commands exit 0 with zero Python safety errors and warnings"
    },
    {
      "invariant_id": "INV-D-1",
      "signal": "Shared runtime helper owns cross-script env/http/logging/write behavior",
      "record_location": "X-Bookmarks Import/x_runtime.py and imports from the three remediated scripts",
      "pass_criteria": "inline duplicate env/HTTP/logging/write helpers are removed from the three scripts and the shared helper is the only owner"
    },
    {
      "invariant_id": "INV-LIF-1",
      "signal": "OAuth/token failure paths are explicit and token writes are atomic",
      "record_location": "X-Bookmarks Import/x_bookmarks_auth.py, X-Bookmarks Import/fetch_bookmarks.py, and X-Bookmarks Import/x_runtime.py",
      "pass_criteria": "OAuth callback rejects invalid state, token writes use temp+replace, and missing credentials exit 1 with explicit logged error"
    },
    {
      "invariant_id": "INV-CLI-1",
      "signal": "CLI offline/help paths remain usable while networked failures are explicit",
      "record_location": "stderr/stdout from governance_research.py --list, x_search.py --help, fetch_bookmarks.py without client creds, and x_search.py --days=abc",
      "pass_criteria": "--list and --help exit 0 without tokens, while invalid network/usage paths exit 1 with explicit messages"
    }
  ],
  "ssot_owner_paths": [
    "X-Bookmarks Import/x_runtime.py",
    "X-Bookmarks Import/x_bookmarks_auth.py",
    "X-Bookmarks Import/x_bookmarks_bookmarks.py",
    "X-Bookmarks Import/fetch_bookmarks.py",
    "X-Bookmarks Import/skills/x-research/scripts/x_search.py",
    "X-Bookmarks Import/skills/governance-autoresearch/scripts/governance_research.py",
    "scripts/check_python_safety/check_python_safety_main.py"
  ],
  "residual_risk": "Retry/backoff policy remains partly script-local across the X-Bookmarks tools, and the stage-4 linker hard-link identity follow-up remains a separate remediation slice.",
  "council_summary": {
    "council_run_id": "council-2026-03-29-post-hold-remediation-final",
    "phase": "post_change",
    "intent_coverage": [
      "ssot_duplication",
      "silent_error",
      "edge_case",
      "resource_security_perf"
    ],
    "reviewers": [
      {
        "id": "R1",
        "role": "full-slice independent audit",
        "scope": "shared runtime helper, decomposed fetcher, CLI tools, master to-do, and hold-remediation change record"
      }
    ],
    "findings": [
      {
        "severity": "LOW",
        "location": "X-Bookmarks Import/x_runtime.py",
        "issue": "Retry/backoff policy is still partly script-local rather than fully centralized in the shared runtime helper.",
        "recommendation": "Promote retry/backoff policy into the shared runtime helper in a follow-up if these tools continue to evolve."
      }
    ],
    "conflicts": "none",
    "reconciliation_decision": "accepted the shared runtime authority fix, fetcher decomposition, and CLI/OAuth failure-path hardening; no remaining blocker for release",
    "residual_risks": "Retry/backoff policy remains partly script-local, but strict safety, strict governance core, and recorded failure-path witnesses all pass.",
    "go_no_go": "go",
    "verification_links": [
      "python3 scripts/check_python_safety/check_python_safety_main.py",
      "python3 scripts/check_governance_core/check_governance_core_main.py --fail-on-safety-warnings",
      "python3 scripts/check_governance_core/check_governance_core_main.py",
      "pwsh -NoProfile -ExecutionPolicy Bypass -File scripts/check_change_records.ps1",
      "X_BEARER_TOKEN='' python3 'X-Bookmarks Import/skills/governance-autoresearch/scripts/governance_research.py' --list",
      "X_BEARER_TOKEN='' python3 'X-Bookmarks Import/skills/x-research/scripts/x_search.py' --help",
      "X_CLIENT_ID='' X_CLIENT_SECRET='' python3 'X-Bookmarks Import/fetch_bookmarks.py'",
      "X_BEARER_TOKEN='dummy' python3 'X-Bookmarks Import/skills/x-research/scripts/x_search.py' --days=abc 'topic'",
      "X_BEARER_TOKEN='' python3 'X-Bookmarks Import/skills/x-research/scripts/x_search.py' 'topic' --emit=bogus"
    ]
  },
  "validation_context": {
    "intended_environment": "AGENTS.MD governance source repo",
    "evidence_plan": "Verify strict safety, strict governance core, change-record validity, and explicit CLI failure-path behavior for the remediated X-Bookmarks scripts.",
    "release_gate_decision": "go",
    "traceability_refs": [
      "README.md#checks",
      "docs/project/master-todo/master-todo.md",
      "docs/project/change-records/2026-03-29-ssot-remediation-stages.json"
    ]
  }
}
